root@comp3134:~# tcpdump -n -i eth0

20:39:48.562820 IP 165.22.235.9.22 > 76.71.137.116.50972: Flags [P.], seq 4430552:4430916, ack 2701, win 501, length 364
20:39:48.562887 IP 165.22.235.9.22 > 76.71.137.116.50972: Flags [P.], seq 4430916:4431072, ack 2701, win 501, length 156
20:39:48.562957 IP 165.22.235.9.22 > 76.71.137.116.50972: Flags [P.], seq 4431072:4431228, ack 2701, win 501, length 156
20:39:48.562972 IP 76.71.137.116.50972 > 165.22.235.9.22: Flags [.], ack 4429436, win 8212, length 0
20:39:48.563039 IP 165.22.235.9.22 > 76.71.137.116.50972: Flags [P.], seq 4431228:4431488, ack 2701, win 501, length 260
20:39:48.563096 IP 165.22.235.9.22 > 76.71.137.116.50972: Flags [P.], seq 4431488:4431644, ack 2701, win 501, length 156
20:39:48.563154 IP 165.22.235.9.22 > 76.71.137.116.50972: Flags [P.], seq 4431644:4431800, ack 2701, win 501, length 156
20:39:48.563209 IP 165.22.235.9.22 > 76.71.137.116.50972: Flags [P.], seq 4431800:4431956, ack 2701, win 501, length 156
20:39:48.563265 IP 165.22.235.9.22 > 76.71.137.116.50972: Flags [P.], seq 4431956:4432112, ack 2701, win 501, length 156
20:39:48.563321 IP 165.22.235.9.22 > 76.71.137.116.50972: Flags [P.], seq 4432112:4432268, ack 2701, win 501, length 156
20:39:48.563359 IP 76.71.137.116.50972 > 165.22.235.9.22: Flags [.], ack 4430084, win 8210, length 0
20:39:48.563403 IP 165.22.235.9.22 > 76.71.137.116.50972: Flags [P.], seq 4432268:4432528, ack 2701, win 501, length 260
20:39:48.563468 IP 165.22.235.9.22 > 76.71.137.116.50972: Flags [P.], seq 4432528:4432684, ack 2701, win 501, length 156
20:39:48.563525 IP 165.22.235.9.22 > 76.71.137.116.50972: Flags [P.], seq 4432684:4432840, ack 2701, win 501, length 156
20:39:48.563607 IP 165.22.235.9.22 > 76.71.137.116.50972: Flags [P.], seq 4432840:4432996, ack 2701, win 501, length 156
20:39:48.563678 IP 165.22.235.9.22 > 76.71.137.116.50972: Flags [P.], seq 4432996:4433152, ack 2701, win 501, length 156
20:39:48.563724 IP 76.71.137.116.50972 > 165.22.235.9.22: Flags [.], ack 4430396, win 8209, length 0
20:39:48.563734 IP 76.71.137.116.50972 > 165.22.235.9.22: Flags [.], ack 4430916, win 8212, length 0
20:39:48.563737 IP 76.71.137.116.50972 > 165.22.235.9.22: Flags [.], ack 4431228, win 8211, length 0
20:39:48.563760 IP 165.22.235.9.22 > 76.71.137.116.50972: Flags [P.], seq 4433152:4433308, ack 2701, win 501, length 156
20:39:48.563855 IP 165.22.235.9.22 > 76.71.137.116.50972: Flags [P.], seq 4433308:4433776, ack 2701, win 501, length 468
20:39:48.563924 IP 165.22.235.9.22 > 76.71.137.116.50972: Flags [P.], seq 4433776:4433932, ack 2701, win 501, length 156
20:39:48.563960 IP 76.71.137.116.50972 > 165.22.235.9.22: Flags [.], ack 4431644, win 8210, length 0
20:39:48.563969 IP 76.71.137.116.50972 > 165.22.235.9.22: Flags [.], ack 4431956, win 8208, length 0
20:39:48.564052 IP 165.22.235.9.22 > 76.71.137.116.50972: Flags [P.], seq 4433932:4434296, ack 2701, win 501, length 364
20:39:48.564122 IP 165.22.235.9.22 > 76.71.137.116.50972: Flags [P.], seq 4434296:4434452, ack 2701, win 501, length 156
20:39:48.564199 IP 165.22.235.9.22 > 76.71.137.116.50972: Flags [P.], seq 4434452:4434608, ack 2701, win 501, length 156
20:39:48.564258 IP 165.22.235.9.22 > 76.71.137.116.50972: Flags [P.], seq 4434608:4434764, ack 2701, win 501, length 156
20:39:48.564314 IP 165.22.235.9.22 > 76.71.137.116.50972: Flags [P.], seq 4434764:4434920, ack 2701, win 501, length 156
20:39:48.564343 IP 76.71.137.116.50972 > 165.22.235.9.22: Flags [.], ack 4432268, win 8207, length 0
20:39:48.564350 IP 76.71.137.116.50972 > 165.22.235.9.22: Flags [.], ack 4432684, win 8212, length 0
20:39:48.564410 IP 165.22.235.9.22 > 76.71.137.116.50972: Flags [P.], seq 4434920:4435284, ack 2701, win 501, length 364
20:39:48.564470 IP 165.22.235.9.22 > 76.71.137.116.50972: Flags [P.], seq 4435284:4435440, ack 2701, win 501, length 156
20:39:48.564526 IP 165.22.235.9.22 > 76.71.137.116.50972: Flags [P.], seq 4435440:4435596, ack 2701, win 501, length 156
20:39:48.564585 IP 165.22.235.9.22 > 76.71.137.116.50972: Flags [P.], seq 4435596:4435752, ack 2701, win 501, length 156
20:39:48.564642 IP 165.22.235.9.22 > 76.71.137.116.50972: Flags [P.], seq 4435752:4435908, ack 2701, win 501, length 156
20:39:48.564696 IP 165.22.235.9.22 > 76.71.137.116.50972: Flags [P.], seq 4435908:4436064, ack 2701, win 501, length 156
20:39:48.564748 IP 76.71.137.116.50972 > 165.22.235.9.22: Flags [.], ack 4432996, win 8211, length 0
20:39:48.564755 IP 76.71.137.116.50972 > 165.22.235.9.22: Flags [.], ack 4433308, win 8210, length 0
20:39:48.564758 IP 76.71.137.116.50972 > 165.22.235.9.22: Flags [.], ack 4433932, win 8208, length 0
20:39:48.564815 IP 165.22.235.9.22 > 76.71.137.116.50972: Flags [P.], seq 4436064:4436532, ack 2701, win 501, length 468
20:39:48.564880 IP 165.22.235.9.22 > 76.71.137.116.50972: Flags [P.], seq 4436532:4436688, ack 2701, win 501, length 156
20:39:48.564939 IP 165.22.235.9.22 > 76.71.137.116.50972: Flags [P.], seq 4436688:4436844, ack 2701, win 501, length 156
20:39:48.564998 IP 165.22.235.9.22 > 76.71.137.116.50972: Flags [P.], seq 4436844:4437000, ack 2701, win 501, length 156
20:39:48.565058 IP 165.22.235.9.22 > 76.71.137.116.50972: Flags [P.], seq 4437000:4437156, ack 2701, win 501, length 156
20:39:48.565106 IP 76.71.137.116.50972 > 165.22.235.9.22: Flags [.], ack 4434452, win 8212, length 0
20:39:48.565113 IP 76.71.137.116.50972 > 165.22.235.9.22: Flags [.], ack 4434764, win 8211, length 0
20:39:48.565191 IP 165.22.235.9.22 > 76.71.137.116.50972: Flags [P.], seq 4437156:4437520, ack 2701, win 501, length 364
20:39:48.565269 IP 165.22.235.9.22 > 76.71.137.116.50972: Flags [P.], seq 4437520:4437676, ack 2701, win 501, length 156
20:39:48.565330 IP 165.22.235.9.22 > 76.71.137.116.50972: Flags [P.], seq 4437676:4437832, ack 2701, win 501, length 156
20:39:48.565348 IP 76.71.137.116.50972 > 165.22.235.9.22: Flags [.], ack 4435284, win 8209, length 0
20:39:48.565357 IP 76.71.137.116.50972 > 165.22.235.9.22: Flags [.], ack 4435596, win 8208, length 0
20:39:48.565360 IP 76.71.137.116.50972 > 165.22.235.9.22: Flags [.], ack 4435908, win 8212, length 0
20:39:48.565457 IP 165.22.235.9.22 > 76.71.137.116.50972: Flags [P.], seq 4437832:4438300, ack 2701, win 501, length 468
20:39:48.565516 IP 165.22.235.9.22 > 76.71.137.116.50972: Flags [P.], seq 4438300:4438456, ack 2701, win 501, length 156
20:39:48.565604 IP 165.22.235.9.22 > 76.71.137.116.50972: Flags [P.], seq 4438456:4438612, ack 2701, win 501, length 156
20:39:48.565674 IP 165.22.235.9.22 > 76.71.137.116.50972: Flags [P.], seq 4438612:4438768, ack 2701, win 501, length 156
20:39:48.565719 IP 76.71.137.116.50972 > 165.22.235.9.22: Flags [.], ack 4436532, win 8210, length 0
20:39:48.565728 IP 76.71.137.116.50972 > 165.22.235.9.22: Flags [.], ack 4437000, win 8208, length 0
20:39:48.565780 IP 165.22.235.9.22 > 76.71.137.116.50972: Flags [P.], seq 4438768:4439132, ack 2701, win 501, length 364
20:39:48.565902 IP 165.22.235.9.22 > 76.71.137.116.50972: Flags [P.], seq 4439132:4439288, ack 2701, win 501, length 156
20:39:48.565966 IP 165.22.235.9.22 > 76.71.137.116.50972: Flags [P.], seq 4439288:4439444, ack 2701, win 501, length 156
20:39:48.566021 IP 165.22.235.9.22 > 76.71.137.116.50972: Flags [P.], seq 4439444:4439600, ack 2701, win 501, length 156
20:39:48.566089 IP 165.22.235.9.22 > 76.71.137.116.50972: Flags [P.], seq 4439600:4439756, ack 2701, win 501, length 156
20:39:48.566111 IP 76.71.137.116.50972 > 165.22.235.9.22: Flags [.], ack 4437156, win 8208, length 0
20:39:48.566116 IP 76.71.137.116.50972 > 165.22.235.9.22: Flags [.], ack 4437676, win 8212, length 0
20:39:48.566196 IP 165.22.235.9.22 > 76.71.137.116.50972: Flags [P.], seq 4439756:4440120, ack 2701, win 501, length 364
20:39:48.566255 IP 165.22.235.9.22 > 76.71.137.116.50972: Flags [P.], seq 4440120:4440276, ack 2701, win 501, length 156
20:39:48.566319 IP 165.22.235.9.22 > 76.71.137.116.50972: Flags [P.], seq 4440276:4440432, ack 2701, win 501, length 156
20:39:48.566383 IP 165.22.235.9.22 > 76.71.137.116.50972: Flags [P.], seq 4440432:4440588, ack 2701, win 501, length 156
20:39:48.566452 IP 165.22.235.9.22 > 76.71.137.116.50972: Flags [P.], seq 4440588:4440744, ack 2701, win 501, length 156
20:39:48.566500 IP 76.71.137.116.50972 > 165.22.235.9.22: Flags [.], ack 4438300, win 8210, length 0
20:39:48.566508 IP 76.71.137.116.50972 > 165.22.235.9.22: Flags [.], ack 4438612, win 8209, length 0
20:39:48.566568 IP 165.22.235.9.22 > 76.71.137.116.50972: Flags [P.], seq 4440744:4441108, ack 2701, win 501, length 364
20:39:48.566628 IP 165.22.235.9.22 > 76.71.137.116.50972: Flags [P.], seq 4441108:4441264, ack 2701, win 501, length 156
20:39:48.566689 IP 165.22.235.9.22 > 76.71.137.116.50972: Flags [P.], seq 4441264:4441420, ack 2701, win 501, length 156
20:39:48.566722 IP 76.71.137.116.50972 > 165.22.235.9.22: Flags [.], ack 4439132, win 8212, length 0
20:39:48.566795 IP 165.22.235.9.22 > 76.71.137.116.50972: Flags [P.], seq 4441420:4441680, ack 2701, win 501, length 260
20:39:48.566859 IP 165.22.235.9.22 > 76.71.137.116.50972: Flags [P.], seq 4441680:4441836, ack 2701, win 501, length 156
20:39:48.566952 IP 165.22.235.9.22 > 76.71.137.116.50972: Flags [P.], seq 4441836:4441992, ack 2701, win 501, length 156
20:39:48.567020 IP 165.22.235.9.22 > 76.71.137.116.50972: Flags [P.], seq 4441992:4442148, ack 2701, win 501, length 156
20:39:48.567077 IP 165.22.235.9.22 > 76.71.137.116.50972: Flags [P.], seq 4442148:4442304, ack 2701, win 501, length 156
20:39:48.567120 IP 76.71.137.116.50972 > 165.22.235.9.22: Flags [.], ack 4439600, win 8211, length 0
20:39:48.567130 IP 76.71.137.116.50972 > 165.22.235.9.22: Flags [.], ack 4439756, win 8210, length 0
20:39:48.567133 IP 76.71.137.116.50972 > 165.22.235.9.22: Flags [.], ack 4440276, win 8208, length 0
20:39:48.567160 IP 165.22.235.9.22 > 76.71.137.116.50972: Flags [P.], seq 4442304:4442460, ack 2701, win 501, length 156
20:39:48.567303 IP 165.22.235.9.22 > 76.71.137.116.50972: Flags [P.], seq 4442460:4442928, ack 2701, win 501, length 468
20:39:48.567387 IP 165.22.235.9.22 > 76.71.137.116.50972: Flags [P.], seq 4442928:4443084, ack 2701, win 501, length 156
20:39:48.567456 IP 165.22.235.9.22 > 76.71.137.116.50972: Flags [P.], seq 4443084:4443240, ack 2701, win 501, length 156
20:39:48.567494 IP 76.71.137.116.50972 > 165.22.235.9.22: Flags [.], ack 4440588, win 8212, length 0
20:39:48.567504 IP 76.71.137.116.50972 > 165.22.235.9.22: Flags [.], ack 4441108, win 8210, length 0
20:39:48.567507 IP 76.71.137.116.50972 > 165.22.235.9.22: Flags [.], ack 4441420, win 8209, length 0
20:39:48.567584 IP 165.22.235.9.22 > 76.71.137.116.50972: Flags [P.], seq 4443240:4443708, ack 2701, win 501, length 468
20:39:48.567649 IP 165.22.235.9.22 > 76.71.137.116.50972: Flags [P.], seq 4443708:4443864, ack 2701, win 501, length 156
20:39:48.567712 IP 76.71.137.116.50972 > 165.22.235.9.22: Flags [.], ack 4441836, win 8208, length 0
20:39:48.567721 IP 165.22.235.9.22 > 76.71.137.116.50972: Flags [P.], seq 4443864:4444020, ack 2701, win 501, length 156
20:39:48.567791 IP 165.22.235.9.22 > 76.71.137.116.50972: Flags [P.], seq 4444020:4444280, ack 2701, win 501, length 260
20:39:48.567847 IP 165.22.235.9.22 > 76.71.137.116.50972: Flags [P.], seq 4444280:4444436, ack 2701, win 501, length 156
20:39:48.567905 IP 165.22.235.9.22 > 76.71.137.116.50972: Flags [P.], seq 4444436:4444592, ack 2701, win 501, length 156
20:39:48.567960 IP 165.22.235.9.22 > 76.71.137.116.50972: Flags [P.], seq 4444592:4444748, ack 2701, win 501, length 156
20:39:48.568018 IP 165.22.235.9.22 > 76.71.137.116.50972: Flags [P.], seq 4444748:4444904, ack 2701, win 501, length 156
20:39:48.568097 IP 76.71.137.116.50972 > 165.22.235.9.22: Flags [.], ack 4442148, win 8212, length 0
20:39:48.568106 IP 76.71.137.116.50972 > 165.22.235.9.22: Flags [.], ack 4442460, win 8211, length 0
20:39:48.568116 IP 165.22.235.9.22 > 76.71.137.116.50972: Flags [P.], seq 4444904:4445060, ack 2701, win 501, length 156
20:39:48.568229 IP 165.22.235.9.22 > 76.71.137.116.50972: Flags [P.], seq 4445060:4445424, ack 2701, win 501, length 364
20:39:48.568323 IP 165.22.235.9.22 > 76.71.137.116.50972: Flags [P.], seq 4445424:4445580, ack 2701, win 501, length 156
20:39:48.568400 IP 165.22.235.9.22 > 76.71.137.116.50972: Flags [P.], seq 4445580:4445736, ack 2701, win 501, length 156
20:39:48.568461 IP 165.22.235.9.22 > 76.71.137.116.50972: Flags [P.], seq 4445736:4445892, ack 2701, win 501, length 156
20:39:48.568478 IP 76.71.137.116.50972 > 165.22.235.9.22: Flags [.], ack 4443084, win 8209, length 0
20:39:48.568488 IP 76.71.137.116.50972 > 165.22.235.9.22: Flags [.], ack 4443708, win 8212, length 0
20:39:48.568490 IP 76.71.137.116.50972 > 165.22.235.9.22: Flags [.], ack 4444020, win 8211, length 0
20:39:48.568567 IP 165.22.235.9.22 > 76.71.137.116.50972: Flags [P.], seq 4445892:4446360, ack 2701, win 501, length 468
20:39:48.568625 IP 165.22.235.9.22 > 76.71.137.116.50972: Flags [P.], seq 4446360:4446516, ack 2701, win 501, length 156
20:39:48.568680 IP 165.22.235.9.22 > 76.71.137.116.50972: Flags [P.], seq 4446516:4446672, ack 2701, win 501, length 156
20:39:48.568736 IP 165.22.235.9.22 > 76.71.137.116.50972: Flags [P.], seq 4446672:4446828, ack 2701, win 501, length 156
20:39:48.568790 IP 165.22.235.9.22 > 76.71.137.116.50972: Flags [P.], seq 4446828:4446984, ack 2701, win 501, length 156
20:39:48.568843 IP 76.71.137.116.50972 > 165.22.235.9.22: Flags [.], ack 4444436, win 8210, length 0
20:39:48.568851 IP 76.71.137.116.50972 > 165.22.235.9.22: Flags [.], ack 4444748, win 8208, length 0
20:39:48.568854 IP 76.71.137.116.50972 > 165.22.235.9.22: Flags [.], ack 4445060, win 8207, length 0
20:39:48.568878 IP 165.22.235.9.22 > 76.71.137.116.50972: Flags [P.], seq 4446984:4447140, ack 2701, win 501, length 156
20:39:48.568974 IP 165.22.235.9.22 > 76.71.137.116.50972: Flags [P.], seq 4447140:4447608, ack 2701, win 501, length 468
20:39:48.569048 IP 165.22.235.9.22 > 76.71.137.116.50972: Flags [P.], seq 4447608:4447764, ack 2701, win 501, length 156
20:39:48.569113 IP 76.71.137.116.50972 > 165.22.235.9.22: Flags [.], ack 4445580, win 8212, length 0
20:39:48.569196 IP 165.22.235.9.22 > 76.71.137.116.50972: Flags [P.], seq 4447764:4448024, ack 2701, win 501, length 260
20:39:48.569277 IP 165.22.235.9.22 > 76.71.137.116.50972: Flags [P.], seq 4448024:4448180, ack 2701, win 501, length 156
20:39:48.569338 IP 165.22.235.9.22 > 76.71.137.116.50972: Flags [P.], seq 4448180:4448336, ack 2701, win 501, length 156
20:39:48.569395 IP 165.22.235.9.22 > 76.71.137.116.50972: Flags [P.], seq 4448336:4448492, ack 2701, win 501, length 156
20:39:48.569494 IP 76.71.137.116.50972 > 165.22.235.9.22: Flags [.], ack 4445892, win 8211, length 0
20:39:48.569505 IP 76.71.137.116.50972 > 165.22.235.9.22: Flags [.], ack 4446516, win 8209, length 0
20:39:48.569559 IP 165.22.235.9.22 > 76.71.137.116.50972: Flags [P.], seq 4448492:4448856, ack 2701, win 501, length 364
20:39:48.569622 IP 165.22.235.9.22 > 76.71.137.116.50972: Flags [P.], seq 4448856:4449012, ack 2701, win 501, length 156
20:39:48.569679 IP 165.22.235.9.22 > 76.71.137.116.50972: Flags [P.], seq 4449012:4449168, ack 2701, win 501, length 156
20:39:48.569733 IP 165.22.235.9.22 > 76.71.137.116.50972: Flags [P.], seq 4449168:4449324, ack 2701, win 501, length 156
20:39:48.569807 IP 165.22.235.9.22 > 76.71.137.116.50972: Flags [P.], seq 4449324:4449480, ack 2701, win 501, length 156
20:39:48.569874 IP 76.71.137.116.50972 > 165.22.235.9.22: Flags [.], ack 4446984, win 8207, length 0
20:39:48.569886 IP 76.71.137.116.50972 > 165.22.235.9.22: Flags [.], ack 4447140, win 8212, length 0
20:39:48.569891 IP 76.71.137.116.50972 > 165.22.235.9.22: Flags [.], ack 4447764, win 8210, length 0
20:39:48.569969 IP 165.22.235.9.22 > 76.71.137.116.50972: Flags [P.], seq 4449480:4449948, ack 2701, win 501, length 468
20:39:48.570033 IP 165.22.235.9.22 > 76.71.137.116.50972: Flags [P.], seq 4449948:4450104, ack 2701, win 501, length 156
20:39:48.570091 IP 76.71.137.116.50972 > 165.22.235.9.22: Flags [.], ack 4448180, win 8208, length 0
20:39:48.570099 IP 76.71.137.116.50972 > 165.22.235.9.22: Flags [.], ack 4448492, win 8207, length 0
20:39:48.570114 IP 165.22.235.9.22 > 76.71.137.116.50972: Flags [P.], seq 4450104:4450260, ack 2701, win 501, length 156
20:39:48.570223 IP 165.22.235.9.22 > 76.71.137.116.50972: Flags [P.], seq 4450260:4450624, ack 2701, win 501, length 364
20:39:48.570280 IP 165.22.235.9.22 > 76.71.137.116.50972: Flags [P.], seq 4450624:4450780, ack 2701, win 501, length 156
20:39:48.570339 IP 165.22.235.9.22 > 76.71.137.116.50972: Flags [P.], seq 4450780:4450936, ack 2701, win 501, length 156
20:39:48.570393 IP 165.22.235.9.22 > 76.71.137.116.50972: Flags [P.], seq 4450936:4451092, ack 2701, win 501, length 156
20:39:48.570448 IP 165.22.235.9.22 > 76.71.137.116.50972: Flags [P.], seq 4451092:4451248, ack 2701, win 501, length 156
20:39:48.570468 IP 76.71.137.116.50972 > 165.22.235.9.22: Flags [.], ack 4449012, win 8212, length 0
20:39:48.570527 IP 165.22.235.9.22 > 76.71.137.116.50972: Flags [P.], seq 4451248:4451508, ack 2701, win 501, length 260
20:39:48.570584 IP 165.22.235.9.22 > 76.71.137.116.50972: Flags [P.], seq 4451508:4451664, ack 2701, win 501, length 156
20:39:48.570638 IP 165.22.235.9.22 > 76.71.137.116.50972: Flags [P.], seq 4451664:4451820, ack 2701, win 501, length 156
20:39:48.570693 IP 165.22.235.9.22 > 76.71.137.116.50972: Flags [P.], seq 4451820:4451976, ack 2701, win 501, length 156
20:39:48.570769 IP 165.22.235.9.22 > 76.71.137.116.50972: Flags [P.], seq 4451976:4452132, ack 2701, win 501, length 156
20:39:48.570825 IP 165.22.235.9.22 > 76.71.137.116.50972: Flags [P.], seq 4452132:4452288, ack 2701, win 501, length 156
20:39:48.570842 IP 76.71.137.116.50972 > 165.22.235.9.22: Flags [.], ack 4449324, win 8211, length 0
20:39:48.570846 IP 76.71.137.116.50972 > 165.22.235.9.22: Flags [.], ack 4449948, win 8209, length 0
20:39:48.570927 IP 165.22.235.9.22 > 76.71.137.116.50972: Flags [P.], seq 4452288:4452652, ack 2701, win 501, length 364
20:39:48.570988 IP 165.22.235.9.22 > 76.71.137.116.50972: Flags [P.], seq 4452652:4452808, ack 2701, win 501, length 156
20:39:48.571053 IP 165.22.235.9.22 > 76.71.137.116.50972: Flags [P.], seq 4452808:4452964, ack 2701, win 501, length 156
20:39:48.571108 IP 165.22.235.9.22 > 76.71.137.116.50972: Flags [P.], seq 4452964:4453120, ack 2701, win 501, length 156
20:39:48.571164 IP 165.22.235.9.22 > 76.71.137.116.50972: Flags [P.], seq 4453120:4453276, ack 2701, win 501, length 156
20:39:48.571218 IP 76.71.137.116.50972 > 165.22.235.9.22: Flags [.], ack 4450260, win 8208, length 0
20:39:48.571233 IP 76.71.137.116.50972 > 165.22.235.9.22: Flags [.], ack 4450780, win 8212, length 0
20:39:48.571240 IP 76.71.137.116.50972 > 165.22.235.9.22: Flags [.], ack 4451248, win 8211, length 0
20:39:48.571317 IP 165.22.235.9.22 > 76.71.137.116.50972: Flags [P.], seq 4453276:4453432, ack 2701, win 501, length 156
20:39:48.571379 IP 165.22.235.9.22 > 76.71.137.116.50972: Flags [P.], seq 4453432:4453772, ack 2701, win 501, length 340
20:39:48.571415 IP 165.22.235.9.22 > 76.71.137.116.50972: Flags [P.], seq 4453772:4453928, ack 2701, win 501, length 156
20:39:48.571471 IP 76.71.137.116.50972 > 165.22.235.9.22: Flags [.], ack 4451664, win 8209, length 0
20:39:48.571481 IP 76.71.137.116.50972 > 165.22.235.9.22: Flags [.], ack 4451820, win 8208, length 0
20:39:48.571498 IP 165.22.235.9.22 > 76.71.137.116.50972: Flags [P.], seq 4453928:4454212, ack 2701, win 501, length 284
20:39:48.571575 IP 165.22.235.9.22 > 76.71.137.116.50972: Flags [P.], seq 4454212:4454576, ack 2701, win 501, length 364
20:39:48.571631 IP 165.22.235.9.22 > 76.71.137.116.50972: Flags [P.], seq 4454576:4454732, ack 2701, win 501, length 156
20:39:48.571685 IP 165.22.235.9.22 > 76.71.137.116.50972: Flags [P.], seq 4454732:4454888, ack 2701, win 501, length 156
20:39:48.571741 IP 165.22.235.9.22 > 76.71.137.116.50972: Flags [P.], seq 4454888:4455044, ack 2701, win 501, length 156
20:39:48.571813 IP 165.22.235.9.22 > 76.71.137.116.50972: Flags [P.], seq 4455044:4455200, ack 2701, win 501, length 156
20:39:48.571852 IP 76.71.137.116.50972 > 165.22.235.9.22: Flags [.], ack 4452288, win 8212, length 0
20:39:48.571860 IP 76.71.137.116.50972 > 165.22.235.9.22: Flags [.], ack 4452652, win 8211, length 0
20:39:48.571862 IP 76.71.137.116.50972 > 165.22.235.9.22: Flags [.], ack 4453120, win 8209, length 0
20:39:48.571938 IP 165.22.235.9.22 > 76.71.137.116.50972: Flags [P.], seq 4455200:4455668, ack 2701, win 501, length 468
20:39:48.572026 IP 165.22.235.9.22 > 76.71.137.116.50972: Flags [P.], seq 4455668:4455824, ack 2701, win 501, length 156
20:39:48.572085 IP 165.22.235.9.22 > 76.71.137.116.50972: Flags [P.], seq 4455824:4455980, ack 2701, win 501, length 156
20:39:48.572153 IP 165.22.235.9.22 > 76.71.137.116.50972: Flags [P.], seq 4455980:4456136, ack 2701, win 501, length 156
20:39:48.572220 IP 76.71.137.116.50972 > 165.22.235.9.22: Flags [.], ack 4453276, win 8209, length 0
20:39:48.572229 IP 76.71.137.116.50972 > 165.22.235.9.22: Flags [.], ack 4453928, win 8212, length 0
20:39:48.572281 IP 165.22.235.9.22 > 76.71.137.116.50972: Flags [P.], seq 4456136:4456500, ack 2701, win 501, length 364
20:39:48.572339 IP 165.22.235.9.22 > 76.71.137.116.50972: Flags [P.], seq 4456500:4456656, ack 2701, win 501, length 156
20:39:48.572396 IP 165.22.235.9.22 > 76.71.137.116.50972: Flags [P.], seq 4456656:4456812, ack 2701, win 501, length 156
20:39:48.572452 IP 165.22.235.9.22 > 76.71.137.116.50972: Flags [P.], seq 4456812:4456968, ack 2701, win 501, length 156
20:39:48.572478 IP 76.71.137.116.50972 > 165.22.235.9.22: Flags [.], ack 4454212, win 8211, length 0
20:39:48.572498 IP 76.71.137.116.50972 > 165.22.235.9.22: Flags [.], ack 4454732, win 8209, length 0
20:39:48.572551 IP 165.22.235.9.22 > 76.71.137.116.50972: Flags [P.], seq 4456968:4457332, ack 2701, win 501, length 364
20:39:48.572612 IP 165.22.235.9.22 > 76.71.137.116.50972: Flags [P.], seq 4457332:4457488, ack 2701, win 501, length 156
20:39:48.572670 IP 165.22.235.9.22 > 76.71.137.116.50972: Flags [P.], seq 4457488:4457644, ack 2701, win 501, length 156
20:39:48.572729 IP 165.22.235.9.22 > 76.71.137.116.50972: Flags [P.], seq 4457644:4457800, ack 2701, win 501, length 156
20:39:48.572783 IP 165.22.235.9.22 > 76.71.137.116.50972: Flags [P.], seq 4457800:4457956, ack 2701, win 501, length 156
20:39:48.572841 IP 165.22.235.9.22 > 76.71.137.116.50972: Flags [P.], seq 4457956:4458112, ack 2701, win 501, length 156
20:39:48.572852 IP 76.71.137.116.50972 > 165.22.235.9.22: Flags [.], ack 4455044, win 8208, length 0
20:39:48.572856 IP 76.71.137.116.50972 > 165.22.235.9.22: Flags [.], ack 4455668, win 8212, length 0
20:39:48.572858 IP 76.71.137.116.50972 > 165.22.235.9.22: Flags [.], ack 4455980, win 8211, length 0
20:39:48.572943 IP 165.22.235.9.22 > 76.71.137.116.50972: Flags [P.], seq 4458112:4458580, ack 2701, win 501, length 468
20:39:48.573001 IP 165.22.235.9.22 > 76.71.137.116.50972: Flags [P.], seq 4458580:4458736, ack 2701, win 501, length 156
20:39:48.573070 IP 165.22.235.9.22 > 76.71.137.116.50972: Flags [P.], seq 4458736:4458892, ack 2701, win 501, length 156
20:39:48.573169 IP 165.22.235.9.22 > 76.71.137.116.50972: Flags [P.], seq 4458892:4459048, ack 2701, win 501, length 156
20:39:48.573216 IP 76.71.137.116.50972 > 165.22.235.9.22: Flags [.], ack 4456500, win 8209, length 0
20:39:48.573227 IP 76.71.137.116.50972 > 165.22.235.9.22: Flags [.], ack 4456812, win 8208, length 0
20:39:48.573230 IP 76.71.137.116.50972 > 165.22.235.9.22: Flags [P.], seq 2701:2737, ack 4456812, win 8208, length 36
20:39:48.573311 IP 165.22.235.9.22 > 76.71.137.116.50972: Flags [P.], seq 4459048:4459532, ack 2737, win 501, length 484
20:39:48.573374 IP 165.22.235.9.22 > 76.71.137.116.50972: Flags [P.], seq 4459532:4459688, ack 2737, win 501, length 156
20:39:48.573436 IP 165.22.235.9.22 > 76.71.137.116.50972: Flags [P.], seq 4459688:4459844, ack 2737, win 501, length 156
20:39:48.573496 IP 165.22.235.9.22 > 76.71.137.116.50972: Flags [P.], seq 4459844:4460000, ack 2737, win 501, length 156
20:39:48.573561 IP 165.22.235.9.22 > 76.71.137.116.50972: Flags [P.], seq 4460000:4460156, ack 2737, win 501, length 156
20:39:48.573647 IP 76.71.137.116.50972 > 165.22.235.9.22: Flags [.], ack 4457332, win 8212, length 0
20:39:48.573661 IP 76.71.137.116.50972 > 165.22.235.9.22: Flags [.], ack 4457800, win 8211, length 0
20:39:48.573666 IP 76.71.137.116.50972 > 165.22.235.9.22: Flags [.], ack 4457956, win 8210, length 0
20:39:48.573700 IP 165.22.235.9.22 > 76.71.137.116.50972: Flags [P.], seq 4460156:4460312, ack 2737, win 501, length 156
20:39:48.573812 IP 165.22.235.9.22 > 76.71.137.116.50972: Flags [P.], seq 4460312:4460780, ack 2737, win 501, length 468
20:39:48.573858 IP 76.71.137.116.50972 > 165.22.235.9.22: Flags [.], ack 4458580, win 8208, length 0
20:39:48.573867 IP 76.71.137.116.50972 > 165.22.235.9.22: Flags [.], ack 4458892, win 8212, length 0
20:39:48.573918 IP 165.22.235.9.22 > 76.71.137.116.50972: Flags [P.], seq 4460780:4461144, ack 2737, win 501, length 364
20:39:48.573982 IP 165.22.235.9.22 > 76.71.137.116.50972: Flags [P.], seq 4461144:4461300, ack 2737, win 501, length 156
20:39:48.574041 IP 165.22.235.9.22 > 76.71.137.116.50972: Flags [P.], seq 4461300:4461456, ack 2737, win 501, length 156
20:39:48.574097 IP 165.22.235.9.22 > 76.71.137.116.50972: Flags [P.], seq 4461456:4461612, ack 2737, win 501, length 156
20:39:48.574156 IP 165.22.235.9.22 > 76.71.137.116.50972: Flags [P.], seq 4461612:4461768, ack 2737, win 501, length 156
20:39:48.574212 IP 165.22.235.9.22 > 76.71.137.116.50972: Flags [P.], seq 4461768:4461924, ack 2737, win 501, length 156
20:39:48.574241 IP 76.71.137.116.50972 > 165.22.235.9.22: Flags [.], ack 4459532, win 8210, length 0
20:39:48.574248 IP 76.71.137.116.50972 > 165.22.235.9.22: Flags [.], ack 4459844, win 8209, length 0
20:39:48.574305 IP 165.22.235.9.22 > 76.71.137.116.50972: Flags [P.], seq 4461924:4462288, ack 2737, win 501, length 364
20:39:48.574367 IP 165.22.235.9.22 > 76.71.137.116.50972: Flags [P.], seq 4462288:4462444, ack 2737, win 501, length 156
20:39:48.574426 IP 165.22.235.9.22 > 76.71.137.116.50972: Flags [P.], seq 4462444:4462600, ack 2737, win 501, length 156
20:39:48.574481 IP 165.22.235.9.22 > 76.71.137.116.50972: Flags [P.], seq 4462600:4462756, ack 2737, win 501, length 156
20:39:48.574546 IP 165.22.235.9.22 > 76.71.137.116.50972: Flags [P.], seq 4462756:4462912, ack 2737, win 501, length 156
20:39:48.574615 IP 76.71.137.116.50972 > 165.22.235.9.22: Flags [.], ack 4460156, win 8207, length 0
20:39:48.574621 IP 76.71.137.116.50972 > 165.22.235.9.22: Flags [.], ack 4460780, win 8212, length 0
20:39:48.574624 IP 165.22.235.9.22 > 76.71.137.116.50972: Flags [P.], seq 4462912:4463068, ack 2737, win 501, length 156
20:39:48.574699 IP 165.22.235.9.22 > 76.71.137.116.50972: Flags [P.], seq 4463068:4463432, ack 2737, win 501, length 364
20:39:48.574771 IP 165.22.235.9.22 > 76.71.137.116.50972: Flags [P.], seq 4463432:4463588, ack 2737, win 501, length 156
20:39:48.574831 IP 165.22.235.9.22 > 76.71.137.116.50972: Flags [P.], seq 4463588:4463744, ack 2737, win 501, length 156
20:39:48.574855 IP 76.71.137.116.50972 > 165.22.235.9.22: Flags [.], ack 4461300, win 8210, length 0
20:39:48.574873 IP 76.71.137.116.50972 > 165.22.235.9.22: Flags [.], ack 4461612, win 8209, length 0
20:39:48.574955 IP 165.22.235.9.22 > 76.71.137.116.50972: Flags [P.], seq 4463744:4464108, ack 2737, win 501, length 364
20:39:48.575023 IP 165.22.235.9.22 > 76.71.137.116.50972: Flags [P.], seq 4464108:4464264, ack 2737, win 501, length 156
20:39:48.575081 IP 165.22.235.9.22 > 76.71.137.116.50972: Flags [P.], seq 4464264:4464420, ack 2737, win 501, length 156
20:39:48.575138 IP 165.22.235.9.22 > 76.71.137.116.50972: Flags [P.], seq 4464420:4464576, ack 2737, win 501, length 156
20:39:48.575195 IP 165.22.235.9.22 > 76.71.137.116.50972: Flags [P.], seq 4464576:4464732, ack 2737, win 501, length 156
20:39:48.575222 IP 76.71.137.116.50972 > 165.22.235.9.22: Flags [.], ack 4461924, win 8208, length 0
20:39:48.575229 IP 76.71.137.116.50972 > 165.22.235.9.22: Flags [.], ack 4462444, win 8212, length 0
20:39:48.575288 IP 165.22.235.9.22 > 76.71.137.116.50972: Flags [P.], seq 4464732:4465096, ack 2737, win 501, length 364
20:39:48.575348 IP 165.22.235.9.22 > 76.71.137.116.50972: Flags [P.], seq 4465096:4465252, ack 2737, win 501, length 156
20:39:48.575403 IP 165.22.235.9.22 > 76.71.137.116.50972: Flags [P.], seq 4465252:4465408, ack 2737, win 501, length 156
20:39:48.575462 IP 165.22.235.9.22 > 76.71.137.116.50972: Flags [P.], seq 4465408:4465564, ack 2737, win 501, length 156
20:39:48.575517 IP 165.22.235.9.22 > 76.71.137.116.50972: Flags [P.], seq 4465564:4465720, ack 2737, win 501, length 156
20:39:48.575573 IP 165.22.235.9.22 > 76.71.137.116.50972: Flags [P.], seq 4465720:4465876, ack 2737, win 501, length 156
20:39:48.575603 IP 76.71.137.116.50972 > 165.22.235.9.22: Flags [.], ack 4462912, win 8211, length 0
20:39:48.575610 IP 76.71.137.116.50972 > 165.22.235.9.22: Flags [.], ack 4463068, win 8210, length 0
20:39:48.575613 IP 76.71.137.116.50972 > 165.22.235.9.22: Flags [.], ack 4463588, win 8208, length 0
20:39:48.575700 IP 165.22.235.9.22 > 76.71.137.116.50972: Flags [P.], seq 4465876:4466344, ack 2737, win 501, length 468
20:39:48.575769 IP 165.22.235.9.22 > 76.71.137.116.50972: Flags [P.], seq 4466344:4466500, ack 2737, win 501, length 156
20:39:48.575863 IP 165.22.235.9.22 > 76.71.137.116.50972: Flags [P.], seq 4466500:4466656, ack 2737, win 501, length 156
20:39:48.575962 IP 165.22.235.9.22 > 76.71.137.116.50972: Flags [P.], seq 4466656:4466812, ack 2737, win 501, length 156
20:39:48.575984 IP 76.71.137.116.50972 > 165.22.235.9.22: Flags [.], ack 4464108, win 8212, length 0
20:39:48.575990 IP 76.71.137.116.50972 > 165.22.235.9.22: Flags [.], ack 4464420, win 8211, length 0
20:39:48.575993 IP 76.71.137.116.50972 > 165.22.235.9.22: Flags [.], ack 4464732, win 8210, length 0
20:39:48.576083 IP 165.22.235.9.22 > 76.71.137.116.50972: Flags [P.], seq 4466812:4467280, ack 2737, win 501, length 468
20:39:48.576149 IP 165.22.235.9.22 > 76.71.137.116.50972: Flags [P.], seq 4467280:4467436, ack 2737, win 501, length 156
20:39:48.576219 IP 76.71.137.116.50972 > 165.22.235.9.22: Flags [.], ack 4465408, win 8207, length 0
20:39:48.576230 IP 76.71.137.116.50972 > 165.22.235.9.22: Flags [.], ack 4465564, win 8212, length 0
20:39:48.576322 IP 165.22.235.9.22 > 76.71.137.116.50972: Flags [P.], seq 4467436:4467800, ack 2737, win 501, length 364
20:39:48.576425 IP 165.22.235.9.22 > 76.71.137.116.50972: Flags [P.], seq 4467800:4467956, ack 2737, win 501, length 156
20:39:48.576498 IP 165.22.235.9.22 > 76.71.137.116.50972: Flags [P.], seq 4467956:4468112, ack 2737, win 501, length 156
20:39:48.576555 IP 165.22.235.9.22 > 76.71.137.116.50972: Flags [P.], seq 4468112:4468268, ack 2737, win 501, length 156
20:39:48.576599 IP 76.71.137.116.50972 > 165.22.235.9.22: Flags [.], ack 4465876, win 8211, length 0
20:39:48.576608 IP 76.71.137.116.50972 > 165.22.235.9.22: Flags [.], ack 4466500, win 8209, length 0
20:39:48.576662 IP 165.22.235.9.22 > 76.71.137.116.50972: Flags [P.], seq 4468268:4468632, ack 2737, win 501, length 364
20:39:48.576727 IP 165.22.235.9.22 > 76.71.137.116.50972: Flags [P.], seq 4468632:4468788, ack 2737, win 501, length 156
20:39:48.576793 IP 165.22.235.9.22 > 76.71.137.116.50972: Flags [P.], seq 4468788:4468944, ack 2737, win 501, length 156
20:39:48.576861 IP 165.22.235.9.22 > 76.71.137.116.50972: Flags [P.], seq 4468944:4469100, ack 2737, win 501, length 156
20:39:48.576963 IP 165.22.235.9.22 > 76.71.137.116.50972: Flags [P.], seq 4469100:4469256, ack 2737, win 501, length 156
20:39:48.576991 IP 76.71.137.116.50972 > 165.22.235.9.22: Flags [.], ack 4466812, win 8208, length 0
20:39:48.577004 IP 76.71.137.116.50972 > 165.22.235.9.22: Flags [.], ack 4467436, win 8212, length 0
20:39:48.577096 IP 165.22.235.9.22 > 76.71.137.116.50972: Flags [P.], seq 4469256:4469620, ack 2737, win 501, length 364
20:39:48.577175 IP 165.22.235.9.22 > 76.71.137.116.50972: Flags [P.], seq 4469620:4469776, ack 2737, win 501, length 156
20:39:48.577221 IP 76.71.137.116.50972 > 165.22.235.9.22: Flags [.], ack 4467956, win 8210, length 0
20:39:48.577287 IP 165.22.235.9.22 > 76.71.137.116.50972: Flags [P.], seq 4469776:4470036, ack 2737, win 501, length 260
20:39:48.577390 IP 165.22.235.9.22 > 76.71.137.116.50972: Flags [P.], seq 4470036:4470192, ack 2737, win 501, length 156
20:39:48.577476 IP 165.22.235.9.22 > 76.71.137.116.50972: Flags [P.], seq 4470192:4470348, ack 2737, win 501, length 156
20:39:48.577558 IP 165.22.235.9.22 > 76.71.137.116.50972: Flags [P.], seq 4470348:4470504, ack 2737, win 501, length 156
20:39:48.577620 IP 76.71.137.116.50972 > 165.22.235.9.22: Flags [.], ack 4468268, win 8209, length 0
20:39:48.577632 IP 76.71.137.116.50972 > 165.22.235.9.22: Flags [.], ack 4468788, win 8207, length 0
20:39:48.577638 IP 76.71.137.116.50972 > 165.22.235.9.22: Flags [.], ack 4469100, win 8212, length 0
20:39:48.577672 IP 165.22.235.9.22 > 76.71.137.116.50972: Flags [P.], seq 4470504:4470660, ack 2737, win 501, length 156
20:39:48.577802 IP 165.22.235.9.22 > 76.71.137.116.50972: Flags [P.], seq 4470660:4471128, ack 2737, win 501, length 468
20:39:48.577890 IP 165.22.235.9.22 > 76.71.137.116.50972: Flags [P.], seq 4471128:4471284, ack 2737, win 501, length 156
20:39:48.577977 IP 76.71.137.116.50972 > 165.22.235.9.22: Flags [.], ack 4469620, win 8210, length 0
20:39:48.578036 IP 165.22.235.9.22 > 76.71.137.116.50972: Flags [P.], seq 4471284:4471440, ack 2737, win 501, length 156
20:39:48.578112 IP 165.22.235.9.22 > 76.71.137.116.50972: Flags [P.], seq 4471440:4471580, ack 2737, win 501, length 140
20:39:48.578187 IP 165.22.235.9.22 > 76.71.137.116.50972: Flags [P.], seq 4471580:4471736, ack 2737, win 501, length 156
20:39:48.578227 IP 165.22.235.9.22 > 76.71.137.116.50972: Flags [P.], seq 4471736:4471892, ack 2737, win 501, length 156
20:39:48.578324 IP 165.22.235.9.22 > 76.71.137.116.50972: Flags [P.], seq 4471892:4472176, ack 2737, win 501, length 284
20:39:48.578382 IP 76.71.137.116.50972 > 165.22.235.9.22: Flags [.], ack 4470036, win 8209, length 0
20:39:48.578392 IP 76.71.137.116.50972 > 165.22.235.9.22: Flags [.], ack 4470348, win 8208, length 0
20:39:48.578474 IP 165.22.235.9.22 > 76.71.137.116.50972: Flags [P.], seq 4472176:4472540, ack 2737, win 501, length 364
20:39:48.578562 IP 165.22.235.9.22 > 76.71.137.116.50972: Flags [P.], seq 4472540:4472696, ack 2737, win 501, length 156
20:39:48.578601 IP 76.71.137.116.50972 > 165.22.235.9.22: Flags [.], ack 4470660, win 8212, length 0
20:39:48.578685 IP 165.22.235.9.22 > 76.71.137.116.50972: Flags [P.], seq 4472696:4472956, ack 2737, win 501, length 260
20:39:48.578792 IP 165.22.235.9.22 > 76.71.137.116.50972: Flags [P.], seq 4472956:4473112, ack 2737, win 501, length 156
20:39:48.578897 IP 165.22.235.9.22 > 76.71.137.116.50972: Flags [P.], seq 4473112:4473268, ack 2737, win 501, length 156
20:39:48.578988 IP 76.71.137.116.50972 > 165.22.235.9.22: Flags [.], ack 4471284, win 8210, length 0
20:39:48.578997 IP 76.71.137.116.50972 > 165.22.235.9.22: Flags [.], ack 4471580, win 8209, length 0
20:39:48.579002 IP 165.22.235.9.22 > 76.71.137.116.50972: Flags [P.], seq 4473268:4473424, ack 2737, win 501, length 156
20:39:48.579121 IP 165.22.235.9.22 > 76.71.137.116.50972: Flags [P.], seq 4473424:4473788, ack 2737, win 501, length 364
20:39:48.579210 IP 165.22.235.9.22 > 76.71.137.116.50972: Flags [P.], seq 4473788:4473944, ack 2737, win 501, length 156
20:39:48.579296 IP 165.22.235.9.22 > 76.71.137.116.50972: Flags [P.], seq 4473944:4474100, ack 2737, win 501, length 156
20:39:48.579357 IP 76.71.137.116.50972 > 165.22.235.9.22: Flags [.], ack 4471892, win 8208, length 0
20:39:48.579369 IP 76.71.137.116.50972 > 165.22.235.9.22: Flags [.], ack 4472540, win 8212, length 0
20:39:48.579402 IP 165.22.235.9.22 > 76.71.137.116.50972: Flags [P.], seq 4474100:4474256, ack 2737, win 501, length 156
20:39:48.579533 IP 165.22.235.9.22 > 76.71.137.116.50972: Flags [P.], seq 4474256:4474620, ack 2737, win 501, length 364
20:39:48.579590 IP 76.71.137.116.50972 > 165.22.235.9.22: Flags [.], ack 4472956, win 8211, length 0
20:39:48.579655 IP 165.22.235.9.22 > 76.71.137.116.50972: Flags [P.], seq 4474620:4474880, ack 2737, win 501, length 260
20:39:48.579735 IP 165.22.235.9.22 > 76.71.137.116.50972: Flags [P.], seq 4474880:4475036, ack 2737, win 501, length 156
20:39:48.579830 IP 165.22.235.9.22 > 76.71.137.116.50972: Flags [P.], seq 4475036:4475192, ack 2737, win 501, length 156
20:39:48.579917 IP 165.22.235.9.22 > 76.71.137.116.50972: Flags [P.], seq 4475192:4475348, ack 2737, win 501, length 156
20:39:48.579970 IP 76.71.137.116.50972 > 165.22.235.9.22: Flags [.], ack 4473268, win 8210, length 0
20:39:48.579981 IP 76.71.137.116.50972 > 165.22.235.9.22: Flags [.], ack 4473788, win 8208, length 0
20:39:48.580056 IP 165.22.235.9.22 > 76.71.137.116.50972: Flags [P.], seq 4475348:4475712, ack 2737, win 501, length 364
20:39:48.580135 IP 165.22.235.9.22 > 76.71.137.116.50972: Flags [P.], seq 4475712:4475868, ack 2737, win 501, length 156
20:39:48.580236 IP 165.22.235.9.22 > 76.71.137.116.50972: Flags [P.], seq 4475868:4476024, ack 2737, win 501, length 156
20:39:48.580299 IP 165.22.235.9.22 > 76.71.137.116.50972: Flags [P.], seq 4476024:4476180, ack 2737, win 501, length 156
20:39:48.580340 IP 76.71.137.116.50972 > 165.22.235.9.22: Flags [.], ack 4474100, win 8212, length 0
20:39:48.580351 IP 76.71.137.116.50972 > 165.22.235.9.22: Flags [.], ack 4474620, win 8210, length 0
20:39:48.580420 IP 165.22.235.9.22 > 76.71.137.116.50972: Flags [P.], seq 4476180:4476544, ack 2737, win 501, length 364
20:39:48.580510 IP 165.22.235.9.22 > 76.71.137.116.50972: Flags [P.], seq 4476544:4476700, ack 2737, win 501, length 156
20:39:48.580602 IP 165.22.235.9.22 > 76.71.137.116.50972: Flags [P.], seq 4476700:4476856, ack 2737, win 501, length 156
20:39:48.580683 IP 165.22.235.9.22 > 76.71.137.116.50972: Flags [P.], seq 4476856:4477012, ack 2737, win 501, length 156
20:39:48.580727 IP 76.71.137.116.50972 > 165.22.235.9.22: Flags [.], ack 4475036, win 8209, length 0
20:39:48.580739 IP 76.71.137.116.50972 > 165.22.235.9.22: Flags [.], ack 4475348, win 8208, length 0
20:39:48.580855 IP 165.22.235.9.22 > 76.71.137.116.50972: Flags [P.], seq 4477012:4477376, ack 2737, win 501, length 364
20:39:48.580943 IP 165.22.235.9.22 > 76.71.137.116.50972: Flags [P.], seq 4477376:4477532, ack 2737, win 501, length 156
20:39:48.580975 IP 76.71.137.116.50972 > 165.22.235.9.22: Flags [.], ack 4475868, win 8212, length 0
20:39:48.581057 IP 165.22.235.9.22 > 76.71.137.116.50972: Flags [P.], seq 4477532:4477792, ack 2737, win 501, length 260
20:39:48.581143 IP 165.22.235.9.22 > 76.71.137.116.50972: Flags [P.], seq 4477792:4477948, ack 2737, win 501, length 156
20:39:48.581235 IP 165.22.235.9.22 > 76.71.137.116.50972: Flags [P.], seq 4477948:4478104, ack 2737, win 501, length 156
20:39:48.581324 IP 165.22.235.9.22 > 76.71.137.116.50972: Flags [P.], seq 4478104:4478260, ack 2737, win 501, length 156
20:39:48.581352 IP 76.71.137.116.50972 > 165.22.235.9.22: Flags [.], ack 4476180, win 8211, length 0
20:39:48.581362 IP 76.71.137.116.50972 > 165.22.235.9.22: Flags [.], ack 4476700, win 8209, length 0
20:39:48.581448 IP 165.22.235.9.22 > 76.71.137.116.50972: Flags [P.], seq 4478260:4478624, ack 2737, win 501, length 364
20:39:48.581522 IP 165.22.235.9.22 > 76.71.137.116.50972: Flags [P.], seq 4478624:4478780, ack 2737, win 501, length 156
20:39:48.581607 IP 165.22.235.9.22 > 76.71.137.116.50972: Flags [P.], seq 4478780:4478936, ack 2737, win 501, length 156
20:39:48.581678 IP 165.22.235.9.22 > 76.71.137.116.50972: Flags [P.], seq 4478936:4479092, ack 2737, win 501, length 156
20:39:48.581720 IP 76.71.137.116.50972 > 165.22.235.9.22: Flags [.], ack 4477012, win 8208, length 0
20:39:48.581731 IP 76.71.137.116.50972 > 165.22.235.9.22: Flags [.], ack 4477532, win 8212, length 0
20:39:48.581864 IP 165.22.235.9.22 > 76.71.137.116.50972: Flags [P.], seq 4479092:4479456, ack 2737, win 501, length 364
20:39:48.582009 IP 165.22.235.9.22 > 76.71.137.116.50972: Flags [P.], seq 4479456:4479612, ack 2737, win 501, length 156
20:39:48.582039 IP 76.71.137.116.50972 > 165.22.235.9.22: Flags [.], ack 4477948, win 8211, length 0
20:39:48.582132 IP 165.22.235.9.22 > 76.71.137.116.50972: Flags [P.], seq 4479612:4479872, ack 2737, win 501, length 260
20:39:48.582223 IP 165.22.235.9.22 > 76.71.137.116.50972: Flags [P.], seq 4479872:4480028, ack 2737, win 501, length 156
20:39:48.582284 IP 165.22.235.9.22 > 76.71.137.116.50972: Flags [P.], seq 4480028:4480184, ack 2737, win 501, length 156
20:39:48.582347 IP 76.71.137.116.50972 > 165.22.235.9.22: Flags [.], ack 4478260, win 8210, length 0
20:39:48.582359 IP 76.71.137.116.50972 > 165.22.235.9.22: Flags [.], ack 4478780, win 8208, length 0
20:39:48.582391 IP 165.22.235.9.22 > 76.71.137.116.50972: Flags [P.], seq 4480184:4480340, ack 2737, win 501, length 156
20:39:48.582500 IP 165.22.235.9.22 > 76.71.137.116.50972: Flags [P.], seq 4480340:4480704, ack 2737, win 501, length 364
20:39:48.582583 IP 165.22.235.9.22 > 76.71.137.116.50972: Flags [P.], seq 4480704:4480860, ack 2737, win 501, length 156
20:39:48.582662 IP 165.22.235.9.22 > 76.71.137.116.50972: Flags [P.], seq 4480860:4481016, ack 2737, win 501, length 156
20:39:48.582775 IP 76.71.137.116.50972 > 165.22.235.9.22: Flags [.], ack 4479092, win 8212, length 0
20:39:48.582791 IP 165.22.235.9.22 > 76.71.137.116.50972: Flags [P.], seq 4481016:4481172, ack 2737, win 501, length 156
20:39:48.582893 IP 165.22.235.9.22 > 76.71.137.116.50972: Flags [P.], seq 4481172:4481432, ack 2737, win 501, length 260
20:39:48.582980 IP 165.22.235.9.22 > 76.71.137.116.50972: Flags [P.], seq 4481432:4481588, ack 2737, win 501, length 156
20:39:48.583069 IP 165.22.235.9.22 > 76.71.137.116.50972: Flags [P.], seq 4481588:4481744, ack 2737, win 501, length 156
20:39:48.583107 IP 76.71.137.116.50972 > 165.22.235.9.22: Flags [.], ack 4479612, win 8210, length 0
20:39:48.583123 IP 76.71.137.116.50972 > 165.22.235.9.22: Flags [.], ack 4480184, win 8208, length 0
20:39:48.583209 IP 165.22.235.9.22 > 76.71.137.116.50972: Flags [P.], seq 4481744:4482108, ack 2737, win 501, length 364
20:39:48.583299 IP 165.22.235.9.22 > 76.71.137.116.50972: Flags [P.], seq 4482108:4482264, ack 2737, win 501, length 156
20:39:48.583340 IP 76.71.137.116.50972 > 165.22.235.9.22: Flags [.], ack 4480340, win 8208, length 0
20:39:48.583422 IP 165.22.235.9.22 > 76.71.137.116.50972: Flags [P.], seq 4482264:4482524, ack 2737, win 501, length 260
20:39:48.583518 IP 165.22.235.9.22 > 76.71.137.116.50972: Flags [P.], seq 4482524:4482680, ack 2737, win 501, length 156
20:39:48.583608 IP 165.22.235.9.22 > 76.71.137.116.50972: Flags [P.], seq 4482680:4482836, ack 2737, win 501, length 156
20:39:48.583746 IP 76.71.137.116.50972 > 165.22.235.9.22: Flags [.], ack 4480860, win 8212, length 0
20:39:48.583757 IP 76.71.137.116.50972 > 165.22.235.9.22: Flags [.], ack 4481172, win 8211, length 0
20:39:48.583840 IP 165.22.235.9.22 > 76.71.137.116.50972: Flags [P.], seq 4482836:4483200, ack 2737, win 501, length 364
20:39:48.583946 IP 165.22.235.9.22 > 76.71.137.116.50972: Flags [P.], seq 4483200:4483356, ack 2737, win 501, length 156
20:39:48.584041 IP 165.22.235.9.22 > 76.71.137.116.50972: Flags [P.], seq 4483356:4483512, ack 2737, win 501, length 156
20:39:48.584102 IP 76.71.137.116.50972 > 165.22.235.9.22: Flags [.], ack 4481588, win 8210, length 0
20:39:48.584112 IP 76.71.137.116.50972 > 165.22.235.9.22: Flags [.], ack 4482108, win 8208, length 0
20:39:48.584211 IP 165.22.235.9.22 > 76.71.137.116.50972: Flags [P.], seq 4483512:4483876, ack 2737, win 501, length 364
20:39:48.584299 IP 165.22.235.9.22 > 76.71.137.116.50972: Flags [P.], seq 4483876:4484032, ack 2737, win 501, length 156
20:39:48.584341 IP 76.71.137.116.50972 > 165.22.235.9.22: Flags [.], ack 4482524, win 8212, length 0
20:39:48.584351 IP 76.71.137.116.50972 > 165.22.235.9.22: Flags [.], ack 4482836, win 8211, length 0
20:39:48.584437 IP 165.22.235.9.22 > 76.71.137.116.50972: Flags [P.], seq 4484032:4484396, ack 2737, win 501, length 364
20:39:48.584523 IP 165.22.235.9.22 > 76.71.137.116.50972: Flags [P.], seq 4484396:4484552, ack 2737, win 501, length 156
20:39:48.584605 IP 165.22.235.9.22 > 76.71.137.116.50972: Flags [P.], seq 4484552:4484708, ack 2737, win 501, length 156
20:39:48.584689 IP 165.22.235.9.22 > 76.71.137.116.50972: Flags [P.], seq 4484708:4484864, ack 2737, win 501, length 156
20:39:48.584740 IP 76.71.137.116.50972 > 165.22.235.9.22: Flags [.], ack 4483356, win 8209, length 0
20:39:48.584821 IP 165.22.235.9.22 > 76.71.137.116.50972: Flags [P.], seq 4484864:4485124, ack 2737, win 501, length 260
20:39:48.584921 IP 165.22.235.9.22 > 76.71.137.116.50972: Flags [P.], seq 4485124:4485280, ack 2737, win 501, length 156
20:39:48.585036 IP 165.22.235.9.22 > 76.71.137.116.50972: Flags [P.], seq 4485280:4485436, ack 2737, win 501, length 156
20:39:48.585120 IP 76.71.137.116.50972 > 165.22.235.9.22: Flags [.], ack 4483876, win 8207, length 0
20:39:48.585178 IP 165.22.235.9.22 > 76.71.137.116.50972: Flags [P.], seq 4485436:4485592, ack 2737, win 501, length 156
20:39:48.585243 IP 165.22.235.9.22 > 76.71.137.116.50972: Flags [P.], seq 4485592:4485852, ack 2737, win 501, length 260
20:39:48.585304 IP 165.22.235.9.22 > 76.71.137.116.50972: Flags [P.], seq 4485852:4486008, ack 2737, win 501, length 156
20:39:48.585360 IP 165.22.235.9.22 > 76.71.137.116.50972: Flags [P.], seq 4486008:4486164, ack 2737, win 501, length 156
20:39:48.585416 IP 165.22.235.9.22 > 76.71.137.116.50972: Flags [P.], seq 4486164:4486320, ack 2737, win 501, length 156
20:39:48.585481 IP 165.22.235.9.22 > 76.71.137.116.50972: Flags [P.], seq 4486320:4486476, ack 2737, win 501, length 156
20:39:48.585490 IP 76.71.137.116.50972 > 165.22.235.9.22: Flags [.], ack 4484396, win 8212, length 0
20:39:48.585495 IP 76.71.137.116.50972 > 165.22.235.9.22: Flags [.], ack 4484708, win 8211, length 0
20:39:48.585566 IP 165.22.235.9.22 > 76.71.137.116.50972: Flags [P.], seq 4486476:4486840, ack 2737, win 501, length 364
20:39:48.585646 IP 165.22.235.9.22 > 76.71.137.116.50972: Flags [P.], seq 4486840:4486996, ack 2737, win 501, length 156
20:39:48.585711 IP 76.71.137.116.50972 > 165.22.235.9.22: Flags [.], ack 4485124, win 8210, length 0
20:39:48.585744 IP 165.22.235.9.22 > 76.71.137.116.50972: Flags [P.], seq 4486996:4487152, ack 2737, win 501, length 156
20:39:48.585851 IP 165.22.235.9.22 > 76.71.137.116.50972: Flags [P.], seq 4487152:4487412, ack 2737, win 501, length 260
20:39:48.585934 IP 165.22.235.9.22 > 76.71.137.116.50972: Flags [P.], seq 4487412:4487568, ack 2737, win 501, length 156
20:39:48.586022 IP 165.22.235.9.22 > 76.71.137.116.50972: Flags [P.], seq 4487568:4487724, ack 2737, win 501, length 156
20:39:48.586125 IP 165.22.235.9.22 > 76.71.137.116.50972: Flags [P.], seq 4487724:4487880, ack 2737, win 501, length 156
20:39:48.586141 IP 76.71.137.116.50972 > 165.22.235.9.22: Flags [.], ack 4485436, win 8208, length 0
20:39:48.586153 IP 76.71.137.116.50972 > 165.22.235.9.22: Flags [.], ack 4486008, win 8212, length 0
20:39:48.586157 IP 76.71.137.116.50972 > 165.22.235.9.22: Flags [.], ack 4486164, win 8212, length 0
20:39:48.586279 IP 165.22.235.9.22 > 76.71.137.116.50972: Flags [P.], seq 4487880:4488348, ack 2737, win 501, length 468
20:39:48.586365 IP 165.22.235.9.22 > 76.71.137.116.50972: Flags [P.], seq 4488348:4488504, ack 2737, win 501, length 156
20:39:48.586445 IP 165.22.235.9.22 > 76.71.137.116.50972: Flags [P.], seq 4488504:4488660, ack 2737, win 501, length 156
20:39:48.586495 IP 76.71.137.116.50972 > 165.22.235.9.22: Flags [.], ack 4486476, win 8211, length 0
20:39:48.586506 IP 76.71.137.116.50972 > 165.22.235.9.22: Flags [.], ack 4486996, win 8209, length 0
20:39:48.586600 IP 165.22.235.9.22 > 76.71.137.116.50972: Flags [P.], seq 4488660:4489024, ack 2737, win 501, length 364
20:39:48.586684 IP 165.22.235.9.22 > 76.71.137.116.50972: Flags [P.], seq 4489024:4489180, ack 2737, win 501, length 156
20:39:48.586725 IP 76.71.137.116.50972 > 165.22.235.9.22: Flags [.], ack 4487412, win 8207, length 0
20:39:48.586815 IP 165.22.235.9.22 > 76.71.137.116.50972: Flags [P.], seq 4489180:4489440, ack 2737, win 501, length 260
20:39:48.586919 IP 165.22.235.9.22 > 76.71.137.116.50972: Flags [P.], seq 4489440:4489596, ack 2737, win 501, length 156
20:39:48.587007 IP 165.22.235.9.22 > 76.71.137.116.50972: Flags [P.], seq 4489596:4489752, ack 2737, win 501, length 156
20:39:48.587085 IP 165.22.235.9.22 > 76.71.137.116.50972: Flags [P.], seq 4489752:4489908, ack 2737, win 501, length 156
20:39:48.587127 IP 76.71.137.116.50972 > 165.22.235.9.22: Flags [.], ack 4487724, win 8212, length 0
20:39:48.587137 IP 76.71.137.116.50972 > 165.22.235.9.22: Flags [.], ack 4488348, win 8210, length 0
20:39:48.587225 IP 165.22.235.9.22 > 76.71.137.116.50972: Flags [P.], seq 4489908:4490272, ack 2737, win 501, length 364
20:39:48.587314 IP 165.22.235.9.22 > 76.71.137.116.50972: Flags [P.], seq 4490272:4490428, ack 2737, win 501, length 156
20:39:48.587394 IP 165.22.235.9.22 > 76.71.137.116.50972: Flags [P.], seq 4490428:4490584, ack 2737, win 501, length 156
20:39:48.587474 IP 165.22.235.9.22 > 76.71.137.116.50972: Flags [P.], seq 4490584:4490740, ack 2737, win 501, length 156
20:39:48.587489 IP 76.71.137.116.50972 > 165.22.235.9.22: Flags [P.], seq 2737:2773, ack 4488504, win 8209, length 36
20:39:48.587495 IP 76.71.137.116.50972 > 165.22.235.9.22: Flags [.], ack 4489024, win 8207, length 0
20:39:48.587498 IP 76.71.137.116.50972 > 165.22.235.9.22: Flags [.], ack 4489180, win 8212, length 0
^C
32441 packets captured
32506 packets received by filter
65 packets dropped by kernel