root@comp3134:~# tcpdump -c 5 -i eth0

tcpdump: verbose output suppressed, use -v or -vv for full protocol decode
listening on eth0, link-type EN10MB (Ethernet), capture size 262144 bytes
20:32:59.101901 IP 165.22.235.9.ssh > 76.71.137.116.50972: Flags [P.], seq 3906699211:3906699247, ack 2104286252, win 501, length 36
20:32:59.103457 IP 165.22.235.9.ssh > 76.71.137.116.50972: Flags [P.], seq 36:144, ack 1, win 501, length 108
20:32:59.103533 IP 165.22.235.9.ssh > 76.71.137.116.50972: Flags [P.], seq 144:180, ack 1, win 501, length 36
20:32:59.103605 IP 165.22.235.9.ssh > 76.71.137.116.50972: Flags [P.], seq 180:288, ack 1, win 501, length 108
20:32:59.103664 IP 165.22.235.9.ssh > 76.71.137.116.50972: Flags [P.], seq 288:324, ack 1, win 501, length 36
5 packets captured
65 packets received by filter
33 packets dropped by kernel